Question Number,Question,Answer1,Answer2,Answer3,Answer4,Category,Difficulty
669,What is data processing types?,Types processing methods,Types include batch streaming,Data processing types computation,Types data handling,Data Science and Data Analytics,Intermediate
670,What is data quality types?,Types quality aspects,Types include accuracy completeness,Data quality types dimensions,Types assessment criteria,Data Science and Data Analytics,Intermediate
671,What is DevOps implementation types?,Types implementation approaches,Types include team structure,DevOps implementation types adoption,Types organizational models,DevOps and CI/CD,Intermediate
672,What is CI/CD pipeline types?,Types pipeline architectures,Types include branch strategies,CI/CD pipeline types workflows,Types deployment approaches,DevOps and CI/CD,Intermediate
673,What is container orchestration types?,Types orchestration platforms,Types include Kubernetes Docker Swarm,Container orchestration types management,Types scheduling systems,DevOps and CI/CD,Intermediate
674,What is monitoring approach types?,Types monitoring strategies,Types include metrics logs,Monitoring approach types observability,Types data collection,DevOps and CI/CD,Intermediate
675,What is infrastructure as code types?,Types IaC approaches,Types include declarative imperative,Infrastructure as code types methodology,Types provisioning styles,DevOps and CI/CD,Intermediate
676,What is Python programming paradigms?,Paradigms programming styles,Paradigms include OOP functional,Python programming paradigms approaches,Paradigms code organization,Python (Programming Language),Intermediate
677,What is Python application types?,Types application domains,Types include web scientific,Python application types uses,Types implementation areas,Python (Programming Language),Beginner
678,What is Python library types?,Types library categories,Types include data science web,Python library types functionality,Types tool classifications,Python (Programming Language),Beginner
679,What is Python framework types?,Types framework categories,Types include web testing,Python framework types structure,Types development support,Python (Programming Language),Intermediate
680,What is Python deployment types?,Types deployment methods,Types include cloud containers,Python deployment types distribution,Types production hosting,Python (Programming Language),Intermediate
681,What is JavaScript runtime types?,Types runtime environments,Types include Node.js Deno,JavaScript runtime types execution,Types platform options,JavaScript / TypeScript,Intermediate
682,What is JavaScript framework types?,Types framework categories,Types include frontend backend,JavaScript framework types specialization,Types application development,JavaScript / TypeScript,Intermediate
683,What is JavaScript module types?,Types module systems,Types include ES6 CommonJS,JavaScript module types organization,Types code structure,JavaScript / TypeScript,Intermediate
684,What is JavaScript testing types?,Types testing approaches,Types include unit integration,JavaScript testing types verification,Types quality assurance,JavaScript / TypeScript,Intermediate
685,What is JavaScript deployment types?,Types deployment methods,Types include static server,JavaScript deployment types hosting,Types production distribution,JavaScript / TypeScript,Intermediate
686,What is algorithm paradigm types?,Types algorithm approaches,Types include greedy dynamic,Algorithm paradigm types strategies,Types problem-solving,Data Structures and Algorithms (DSA),Intermediate
687,What is data structure types?,Types structure categories,Types include linear hierarchical,Data structure types organization,Types data management,Data Structures and Algorithms (DSA),Beginner
688,What is complexity class types?,Types complexity categories,Types include P NP,Complexity class types efficiency,Types computational difficulty,Data Structures and Algorithms (DSA),Advanced
689,What is algorithm optimization types?,Types optimization approaches,Types include time space,Algorithm optimization types improvement,Types performance enhancement,Data Structures and Algorithms (DSA),Advanced
690,What is algorithm analysis types?,Types analysis methods,Types include asymptotic amortized,Algorithm analysis types evaluation,Types performance measurement,Data Structures and Algorithms (DSA),Intermediate
691,What is database model types?,Types data models,Types include relational document,Database model types structure,Types organization approaches,Database Management (SQL/NoSQL),Intermediate
692,What is database architecture types?,Types architecture styles,Types include client-server distributed,Database architecture types design,Types system structure,Database Management (SQL/NoSQL),Intermediate
693,What is database transaction types?,Types transaction categories,Types include read-only read-write,Database transaction types operations,Types data manipulation,Database Management (SQL/NoSQL),Intermediate
694,What is database index types?,Types index structures,Types include B-tree hash,Database index types optimization,Types search acceleration,Database Management (SQL/NoSQL),Intermediate
695,What is database backup types?,Types backup methods,Types include full differential,Database backup types protection,Types recovery strategies,Database Management (SQL/NoSQL),Intermediate
696,What is React architecture types?,Types architecture patterns,Types include MVC flux,React architecture types structure,Types application organization,Full-Stack Development,Intermediate
697,What is React state types?,Types state categories,Types include local global,React state types management,Types data storage,Full-Stack Development,Intermediate
698,What is React component types?,Types component categories,Types include presentational container,React component types roles,Types functionality separation,Full-Stack Development,Intermediate
699,What is React testing types?,Types testing approaches,Types include unit integration,React testing types verification,Types quality assurance,Full-Stack Development,Intermediate
700,What is React performance types?,Types performance aspects,Types include rendering bundle,React performance types optimization,Types speed improvement,Full-Stack Development,Advanced
701,What is CSS methodology types?,Types methodology approaches,Types include BEM SMACSS,CSS methodology types organization,Types styling structure,Full-Stack Development,Intermediate
702,What is CSS layout types?,Types layout systems,Types include Flexbox Grid,CSS layout types positioning,Types element arrangement,Full-Stack Development,Intermediate
703,What is CSS preprocessor types?,Types preprocessor languages,Types include Sass Less,CSS preprocessor types enhancement,Types advanced features,Full-Stack Development,Intermediate
704,What is CSS framework types?,Types framework styles,Types include utility component,CSS framework types approach,Types development methodology,Full-Stack Development,Intermediate
705,What is CSS optimization types?,Types optimization methods,Types include minification critical,CSS optimization types improvement,Types performance enhancement,Full-Stack Development,Intermediate
706,What is machine learning algorithm types?,Types algorithm categories,Types include supervised unsupervised,Machine learning algorithm types approaches,Types learning methods,Artificial Intelligence (AI) and Machine Learning (ML),Intermediate
707,What is neural network types?,Types network architectures,Types include CNN RNN,Neural network types structure,Types model designs,Artificial Intelligence (AI) and Machine Learning (ML),Intermediate
708,What is deep learning model types?,Types model architectures,Types include transformers GANs,Deep learning model types innovation,Types advanced architectures,Artificial Intelligence (AI) and Machine Learning (ML),Advanced
709,What is computer vision model types?,Types vision models,Types include classification segmentation,Computer vision model types tasks,Types image processing,Artificial Intelligence (AI) and Machine Learning (ML),Intermediate
710,What is NLP model types?,Types language models,Types include BERT GPT,NLP model types understanding,Types text processing,Artificial Intelligence (AI) and Machine Learning (ML),Intermediate
711,What is cloud storage service types?,Types storage services,Types include object block file,Cloud storage service types functionality,Types data storage options,Cloud Computing (AWS/Azure/GCP),Intermediate
712,What is cloud compute service types?,Types compute services,Types include VMs containers serverless,Cloud compute service types processing,Types execution environments,Cloud Computing (AWS/Azure/GCP),Intermediate
713,What is cloud database service types?,Types database services,Types include relational NoSQL,Cloud database service types management,Types data storage solutions,Cloud Computing (AWS/Azure/GCP),Intermediate
714,What is cloud networking service types?,Types networking services,Types include VPC CDN,Cloud networking service types connectivity,Types network management,Cloud Computing (AWS/Azure/GCP),Intermediate
715,What is cloud security service types?,Types security services,Types include IAM WAF,Cloud security service types protection,Types threat management,Cloud Computing (AWS/Azure/GCP),Intermediate
716,What is security certification levels?,Levels certification tiers,Levels include associate professional,Security certification levels expertise,Levels skill recognition,Cybersecurity,Intermediate
717,What is security framework levels?,Levels framework maturity,Levels include basic advanced,Security framework levels implementation,Levels adoption stages,Cybersecurity,Intermediate
718,What is security control levels?,Levels control implementation,Levels include technical administrative,Security control levels enforcement,Levels protection layers,Cybersecurity,Intermediate
719,What is security assessment levels?,Levels assessment depth,Levels include basic comprehensive,Security assessment levels thoroughness,Levels evaluation intensity,Cybersecurity,Intermediate
720,What is security maturity levels?,Levels program maturity,Levels include initial optimized,Security maturity levels progression,Levels development stages,Cybersecurity,Intermediate
721,What is data maturity levels?,Levels data capability,Levels include basic advanced,Data maturity levels sophistication,Levels organizational growth,Data Science and Data Analytics,Intermediate
722,What is data governance levels?,Levels governance implementation,Levels include project enterprise,Data governance levels scope,Levels management breadth,Data Science and Data Analytics,Intermediate
723,What is data quality levels?,Levels quality achievement,Levels include poor excellent,Data quality levels measurement,Levels reliability assessment,Data Science and Data Analytics,Intermediate
724,What is data security levels?,Levels security implementation,Levels include basic comprehensive,Data security levels protection,Levels safeguard intensity,Data Science and Data Analytics,Intermediate
725,What is data analytics levels?,Levels analytical capability,Levels include descriptive predictive,Data analytics levels sophistication,Levels insight depth,Data Science and Data Analytics,Intermediate
726,What is DevOps maturity levels?,Levels maturity stages,Levels include initial optimized,DevOps maturity levels progression,Levels transformation stages,DevOps and CI/CD,Intermediate
727,What is CI/CD maturity levels?,Levels pipeline sophistication,Levels include manual automated,CI/CD maturity levels automation,Levels efficiency stages,DevOps and CI/CD,Intermediate
728,What is container maturity levels?,Levels container adoption,Levels include basic advanced,Container maturity levels usage,Levels implementation stages,DevOps and CI/CD,Intermediate
729,What is monitoring maturity levels?,Levels monitoring capability,Levels include reactive proactive,Monitoring maturity levels sophistication,Levels observability stages,DevOps and CI/CD,Intermediate
730,What is automation maturity levels?,Levels automation implementation,Levels include manual full,Automation maturity levels efficiency,Levels process improvement,DevOps and CI/CD,Intermediate
731,What is Python skill levels?,Levels proficiency stages,Levels include beginner expert,Python skill levels capability,Levels expertise measurement,Python (Programming Language),Beginner
732,What is Python project complexity levels?,Levels project difficulty,Levels include simple complex,Python project complexity levels challenge,Levels implementation difficulty,Python (Programming Language),Intermediate
733,What is Python performance levels?,Levels performance optimization,Levels include basic advanced,Python performance levels efficiency,Levels speed improvement,Python (Programming Language),Advanced
734,What is Python testing levels?,Levels testing thoroughness,Levels include unit integration,Python testing levels coverage,Levels quality assurance,Python (Programming Language),Intermediate
735,What is Python deployment levels?,Levels deployment sophistication,Levels include simple production,Python deployment levels complexity,Levels distribution maturity,Python (Programming Language),Intermediate
736,What is JavaScript skill levels?,Levels proficiency stages,Levels include beginner expert,JavaScript skill levels capability,Levels expertise measurement,JavaScript / TypeScript,Beginner
737,What is JavaScript project complexity levels?,Levels project difficulty,Levels include simple complex,JavaScript project complexity levels challenge,Levels implementation difficulty,JavaScript / TypeScript,Intermediate
738,What is JavaScript performance levels?,Levels performance optimization,Levels include basic advanced,JavaScript performance levels efficiency,Levels speed improvement,JavaScript / TypeScript,Advanced
739,What is JavaScript testing levels?,Levels testing thoroughness,Levels include unit integration,JavaScript testing levels coverage,Levels quality assurance,JavaScript / TypeScript,Intermediate
740,What is JavaScript deployment levels?,Levels deployment sophistication,Levels include simple production,JavaScript deployment levels complexity,Levels distribution maturity,JavaScript / TypeScript,Intermediate
741,What is algorithm difficulty levels?,Levels problem difficulty,Levels include easy hard,Algorithm difficulty levels challenge,Levels solution complexity,Data Structures and Algorithms (DSA),Intermediate
742,What is data structure complexity levels?,Levels structure complexity,Levels include simple advanced,Data structure complexity levels sophistication,Levels implementation difficulty,Data Structures and Algorithms (DSA),Intermediate
743,What is optimization difficulty levels?,Levels optimization challenge,Levels include basic advanced,Optimization difficulty levels improvement,Levels enhancement complexity,Data Structures and Algorithms (DSA),Advanced
744,What is problem-solving levels?,Levels solution approaches,Levels include naive optimal,Problem-solving levels efficiency,Levels methodology sophistication,Data Structures and Algorithms (DSA),Intermediate
745,What is implementation difficulty levels?,Levels coding difficulty,Levels include straightforward complex,Implementation difficulty levels development,Levels programming challenge,Data Structures and Algorithms (DSA),Intermediate
746,What is database complexity levels?,Levels system complexity,Levels include simple enterprise,Database complexity levels scale,Levels implementation difficulty,Database Management (SQL/NoSQL),Intermediate
747,What is query complexity levels?,Levels query difficulty,Levels include basic advanced,Query complexity levels optimization,Levels statement sophistication,Database Management (SQL/NoSQL),Intermediate
748,What is performance optimization levels?,Levels optimization depth,Levels include basic advanced,Performance optimization levels improvement,Levels enhancement stages,Database Management (SQL/NoSQL),Advanced
749,What is security implementation levels?,Levels security deployment,Levels include basic comprehensive,Security implementation levels protection,Levels safeguard intensity,Database Management (SQL/NoSQL),Intermediate
750,What is scalability achievement levels?,Levels scalability success,Levels include limited high,Scalability achievement levels growth,Levels capacity handling,Database Management (SQL/NoSQL),Intermediate
751,What is React application size levels?,Levels application scale,Levels include small large,React application size levels complexity,Levels project magnitude,Full-Stack Development,Intermediate
752,What is state management complexity levels?,Levels state complexity,Levels include simple complex,State management complexity levels organization,Levels data flow difficulty,Full-Stack Development,Intermediate
753,What is performance optimization levels?,Levels optimization depth,Levels include basic advanced,Performance optimization levels improvement,Levels speed enhancement,Full-Stack Development,Advanced
754,What is testing coverage levels?,Levels testing thoroughness,Levels include partial complete,Testing coverage levels quality,Levels verification extent,Full-Stack Development,Intermediate
755,What is accessibility implementation levels?,Levels accessibility adoption,Levels include basic comprehensive,Accessibility implementation levels inclusion,Levels user support,Full-Stack Development,Intermediate
756,What is CSS complexity levels?,Levels styling complexity,Levels include simple advanced,CSS complexity levels sophistication,Levels implementation difficulty,Full-Stack Development,Intermediate
757,What is layout complexity levels?,Levels layout difficulty,Levels include basic complex,Layout complexity levels arrangement,Levels positioning challenge,Full-Stack Development,Intermediate
758,What is responsive design levels?,Levels responsiveness implementation,Levels include basic advanced,Responsive design levels adaptation,Levels device support,Full-Stack Development,Intermediate
759,What is browser compatibility levels?,Levels compatibility achievement,Levels include limited full,Browser compatibility levels support,Levels cross-browser functionality,Full-Stack Development,Intermediate
760,What is maintenance difficulty levels?,Levels maintenance challenge,Levels include easy difficult,Maintenance difficulty levels upkeep,Levels code management,Full-Stack Development,Intermediate
761,What is machine learning project stages?,Stages project lifecycle,Stages include data modeling,Machine learning project stages progression,Stages development workflow,Artificial Intelligence (AI) and Machine Learning (ML),Intermediate
762,What is model development stages?,Stages model creation,Stages include training evaluation,Model development stages progression,Stages building process,Artificial Intelligence (AI) and Machine Learning (ML),Intermediate
763,What is deployment pipeline stages?,Stages deployment process,Stages include testing monitoring,Deployment pipeline stages workflow,Stages production transition,Artificial Intelligence (AI) and Machine Learning (ML),Intermediate
764,What is data preparation stages?,Stages data processing,Stages include cleaning transformation,Data preparation stages refinement,Stages quality improvement,Artificial Intelligence (AI) and Machine Learning (ML),Intermediate
765,What is model evaluation stages?,Stages assessment process,Stages include validation testing,Model evaluation stages verification,Stages performance measurement,Artificial Intelligence (AI) and Machine Learning (ML),Intermediate
766,What is cloud migration stages?,Stages migration process,Stages include assessment planning,Cloud migration stages transition,Stages implementation workflow,Cloud Computing (AWS/Azure/GCP),Intermediate
767,What is infrastructure deployment stages?,Stages deployment process,Stages include provisioning configuration,Infrastructure deployment stages setup,Stages environment creation,Cloud Computing (AWS/Azure/GCP),Intermediate
768,What is security implementation stages?,Stages security deployment,Stages include assessment monitoring,Security implementation stages progression,Stages protection establishment,Cloud Computing (AWS/Azure/GCP),Intermediate
769,What is cost optimization stages?,Stages optimization process,Stages include analysis implementation,Cost optimization stages improvement,Stages spending reduction,Cloud Computing (AWS/Azure/GCP),Intermediate
770,What is performance tuning stages?,Stages tuning process,Stages include monitoring optimization,Performance tuning stages improvement,Stages speed enhancement,Cloud Computing (AWS/Azure/GCP),Intermediate
771,What is security program stages?,Stages program development,Stages include planning implementation,Security program stages progression,Stages maturity growth,Cybersecurity,Intermediate
772,What is risk management stages?,Stages risk process,Stages include assessment treatment,Risk management stages workflow,Stages threat handling,Cybersecurity,Intermediate
773,What is incident response stages?,Stages response process,Stages include detection recovery,Incident response stages workflow,Stages breach handling,Cybersecurity,Intermediate
774,What is vulnerability management stages?,Stages management process,Stages include discovery remediation,Vulnerability management stages workflow,Stages weakness handling,Cybersecurity,Intermediate
775,What is compliance achievement stages?,Stages compliance process,Stages include assessment certification,Compliance achievement stages verification,Stages requirement meeting,Cybersecurity,Intermediate
776,What is data analytics stages?,Stages analytical process,Stages include preparation modeling,Data analytics stages workflow,Stages insight generation,Data Science and Data Analytics,Intermediate
777,What is data governance stages?,Stages governance implementation,Stages include planning operation,Data governance stages progression,Stages management establishment,Data Science and Data Analytics,Intermediate
778,What is data quality stages?,Stages quality improvement,Stages include assessment enhancement,Data quality stages progression,Stages reliability development,Data Science and Data Analytics,Intermediate
779,What is data integration stages?,Stages integration process,Stages include extraction loading,Data integration stages workflow,Stages consolidation process,Data Science and Data Analytics,Intermediate
780,What is data visualization stages?,Stages visualization creation,Stages include design implementation,Data visualization stages workflow,Stages presentation development,Data Science and Data Analytics,Intermediate
781,What is DevOps transformation stages?,Stages transformation process,Stages include assessment optimization,DevOps transformation stages progression,Stages cultural change,DevOps and CI/CD,Intermediate
782,What is CI/CD implementation stages?,Stages pipeline implementation,Stages include setup optimization,CI/CD implementation stages progression,Stages automation establishment,DevOps and CI/CD,Intermediate
783,What is container adoption stages?,Stages adoption process,Stages include experimentation production,Container adoption stages progression,Stages implementation growth,DevOps and CI/CD,Intermediate
784,What is monitoring implementation stages?,Stages monitoring setup,Stages include basic advanced,Monitoring implementation stages progression,Stages observability growth,DevOps and CI/CD,Intermediate
785,What is automation implementation stages?,Stages automation adoption,Stages include manual full,Automation implementation stages progression,Stages efficiency growth,DevOps and CI/CD,Intermediate
786,What is Python learning stages?,Stages learning progression,Stages include beginner advanced,Python learning stages development,Stages skill acquisition,Python (Programming Language),Beginner
787,What is project development stages?,Stages development process,Stages include planning deployment,Project development stages workflow,Stages creation progression,Python (Programming Language),Intermediate
788,What is testing implementation stages?,Stages testing adoption,Stages include unit integration,Testing implementation stages progression,Stages quality assurance,Python (Programming Language),Intermediate
789,What is deployment preparation stages?,Stages deployment planning,Stages include testing optimization,Deployment preparation stages readiness,Stages production preparation,Python (Programming Language),Intermediate
790,What is code quality stages?,Stages quality improvement,Stages include basic excellent,Code quality stages progression,Stages excellence achievement,Python (Programming Language),Intermediate
791,What is JavaScript learning stages?,Stages learning progression,Stages include beginner advanced,JavaScript learning stages development,Stages skill acquisition,JavaScript / TypeScript,Beginner
792,What is application development stages?,Stages development process,Stages include design deployment,Application development stages workflow,Stages creation progression,JavaScript / TypeScript,Intermediate
793,What is framework adoption stages?,Stages adoption process,Stages include learning mastery,Framework adoption stages progression,Stages tool proficiency,JavaScript / TypeScript,Intermediate
794,What is performance optimization stages?,Stages optimization process,Stages include analysis implementation,Performance optimization stages improvement,Stages speed enhancement,JavaScript / TypeScript,Advanced
795,What is maintenance implementation stages?,Stages maintenance process,Stages include planning execution,Maintenance implementation stages workflow,Stages upkeep management,JavaScript / TypeScript,Intermediate
