Question Number,Question,Answer1,Answer2,Answer3,Answer4,Category,Difficulty
303,What is circuit breaker pattern?,Circuit breaker prevents cascading failures services,Circuit breaker stops requests failing services,Breaker pattern improves system resilience,Circuit breaker essential fault tolerance,DevOps and CI/CD,Advanced
304,What is service discovery?,Service discovery automatically detecting network locations services,Discovery enables dynamic service registration finding,Service discovery crucial microservices environments,Discovery patterns include client server-side,DevOps and CI/CD,Intermediate
305,What is configuration server?,Configuration server centralizes application configuration,Configuration server manages externalized settings,Centralized configuration enables dynamic updates,Configuration server essential cloud applications,DevOps and CI/CD,Intermediate
306,What is distributed logging?,Distributed logging aggregating logs multiple services,Centralized logging enables cross-service tracing,Distributed logging crucial troubleshooting microservices,Log aggregation provides system-wide visibility,DevOps and CI/CD,Intermediate
307,What is health check endpoint?,Health check endpoint monitoring service availability,Health checks verify service functionality readiness,Health endpoints enable load balancer decisions,Health monitoring essential reliable systems,DevOps and CI/CD,Intermediate
308,What is rate limiting?,Rate limiting controlling request frequency clients,Rate limiting prevents abuse ensures fairness,Throttling protects services overload,Rate limiting crucial API management,DevOps and CI/CD,Intermediate
309,What is load testing?,Load testing evaluating system performance under load,Load testing identifies performance bottlenecks,Testing ensures system handles expected traffic,Load testing crucial capacity planning,DevOps and CI/CD,Intermediate
310,What is stress testing?,Stress testing determining system breaking points,Stress testing beyond normal operational capacity,Testing reveals system limits recovery,Stress testing ensures system resilience,DevOps and CI/CD,Advanced
311,What is Python decorator with parameters?,Decorator with parameters creates configurable decorators,Parameterized decorators accept arguments customization,Nested functions enable parameterized decorators,Advanced decorators provide flexible functionality,Python (Programming Language),Advanced
312,What is Python metaclass?,Metaclass class classes controlling class creation,Metaclasses enable advanced class customization,Metaclass programming advanced Python feature,Metaclasses control class instantiation behavior,Python (Programming Language),Advanced
313,What is Python descriptor?,Descriptor protocol controlling attribute access,Descriptors enable customized attribute handling,Descriptor protocol includes get set delete,Descriptors power properties methods,Python (Programming Language),Advanced
314,What is Python contextlib?,Contextlib utilities context managers,Contextlib simplifies context manager creation,Utilities include contextmanager decorator,Contextlib enables cleaner resource management,Python (Programming Language),Intermediate
315,What is Python dataclass?,Dataclass decorator automatically generating special methods,Dataclasses reduce boilerplate code,Data classes ideal data containers,Dataclasses Python 3.7+ feature,Python (Programming Language),Intermediate
316,What is JavaScript Promise.all?,Promise.all executes multiple promises concurrently,Promise.all waits all promises resolve,Promise.all fails fast any promise rejects,Promise.all enables parallel async operations,JavaScript / TypeScript,Intermediate
317,What is JavaScript async iteration?,Async iteration using for-await-of loops,Async iterables work with asynchronous data,Async iteration handles streaming data,Async iteration ES2018 feature,JavaScript / TypeScript,Advanced
318,What is JavaScript Proxy?,Proxy object enabling custom object behavior,Proxy traps intercept object operations,Proxy enables meta-programming capabilities,Proxy powerful reflection feature,JavaScript / TypeScript,Advanced
319,What is JavaScript Reflect?,Reflect object providing introspection capabilities,Reflect methods correspond object operations,Reflect enables meta-programming,Reflect standardizes object operations,JavaScript / TypeScript,Advanced
320,What is JavaScript Symbol?,Symbol primitive creating unique identifiers,Symbols prevent property name collisions,Symbols enable private object properties,Symbols ES6 new primitive type,JavaScript / TypeScript,Intermediate
321,What is heap data structure?,Heap tree-based structure heap property,Heaps enable efficient priority queues,Binary heap common heap implementation,Heap operations include insert extract-min,Data Structures and Algorithms (DSA),Intermediate
322,What is trie data structure?,Trie tree structure storing dynamic sets,Trie efficient prefix searches,Trie used autocomplete dictionaries,Trie enables fast string operations,Data Structures and Algorithms (DSA),Advanced
323,What is disjoint set union?,Disjoint set union-find data structure,Union-find manages partition sets,Disjoint set enables efficient merging,Union-find used connectivity problems,Data Structures and Algorithms (DSA),Advanced
324,What is segment tree?,Segment tree enables range queries updates,Segment tree efficient range operations,Segment tree binary tree structure,Segment tree used interval queries,Data Structures and Algorithms (DSA),Advanced
325,What is Fenwick tree?,Fenwick tree binary indexed tree,Fenwick tree efficient range queries,Fenwick tree simpler segment tree,Fenwick tree used cumulative frequencies,Data Structures and Algorithms (DSA),Advanced
326,What is database indexing strategy?,Indexing strategy designing effective indexes,Strategy considers query patterns data,Proper indexing improves performance,Indexing strategy balances read write,Database Management (SQL/NoSQL),Advanced
327,What is query optimization?,Query optimization improving SQL query performance,Optimizer chooses efficient execution plans,Query optimization reduces response time,Optimization crucial database performance,Database Management (SQL/NoSQL),Advanced
328,What is database partitioning?,Partitioning dividing tables smaller pieces,Partitioning improves manageability performance,Partitioning strategies include range hash,Partitioning enables better data management,Database Management (SQL/NoSQL),Advanced
329,What is materialized view?,Materialized view storing query results,Materialized views improve query performance,Views precompute expensive queries,Materialized views trade storage speed,Database Management (SQL/NoSQL),Advanced
330,What is database lock?,Lock mechanism controlling concurrent access,Locks prevent data corruption conflicts,Lock types include shared exclusive,Lock management crucial concurrency control,Database Management (SQL/NoSQL),Advanced
331,What is React suspense?,Suspense handling asynchronous operations React,Suspense enables better loading states,Suspense works lazy loading data,Suspense improves user experience,Full-Stack Development,Intermediate
332,What is React error boundaries?,Error boundaries catching JavaScript errors,Error boundaries prevent whole app crashes,Error boundaries class components,Error boundaries improve app resilience,Full-Stack Development,Intermediate
333,What is React portal?,Portal rendering children DOM node,Portal enables modal tooltip creation,Portal useful breaking out container,Portal maintains React event handling,Full-Stack Development,Intermediate
334,What is React memo?,Memo preventing unnecessary re-renders,Memo performs shallow prop comparison,Memo optimizes functional components,Memo similar PureComponent functions,Full-Stack Development,Intermediate
335,What is React lazy?,Lazy enabling code splitting components,Lazy dynamically imports components,Lazy improves initial load performance,Lazy works Suspense loading states,Full-Stack Development,Intermediate
336,What is CSS-in-JS?,CSS-in-JS styling components JavaScript,CSS-in-JS enables scoped styles,Popular libraries styled-components emotion,CSS-in-JS provides dynamic styling,Full-Stack Development,Intermediate
337,What is CSS custom properties?,CSS custom properties CSS variables,Custom properties enable themeing,CSS variables dynamic value changes,Custom properties improve maintainability,Full-Stack Development,Intermediate
338,What is CSS BEM methodology?,BEM Block Element Modifier naming convention,BEM provides structured CSS naming,BEM improves CSS scalability,BEM methodology component-based,Full-Stack Development,Intermediate
339,What is web component?,Web component creating reusable custom elements,Web components use shadow DOM encapsulation,Web components framework-agnostic,Web components native browser feature,Full-Stack Development,Advanced
340,What is progressive enhancement?,Progressive enhancement core functionality first,Progressive enhancement adds features capable browsers,Progressive enhancement ensures basic access,Progressive enhancement inclusive design,Full-Stack Development,Intermediate
341,What is ensemble learning?,Ensemble learning combining multiple models,Ensemble methods improve predictions,Ensemble reduces overfitting variance,Popular ensembles bagging boosting,Artificial Intelligence (AI) and Machine Learning (ML),Intermediate
342,What is XGBoost algorithm?,XGBoost optimized gradient boosting implementation,XGBoost provides regularization features,XGBoost handles missing values efficiently,XGBoost powerful competition-winning algorithm,Artificial Intelligence (AI) and Machine Learning (ML),Advanced
343,What is LightGBM algorithm?,LightGBM fast gradient boosting framework,LightGBM uses histogram-based algorithms,LightGBM efficient memory computation,LightGBM handles large datasets well,Artificial Intelligence (AI) and Machine Learning (ML),Advanced
344,What is CatBoost algorithm?,CatBoost handles categorical features automatically,CatBoost provides robust gradient boosting,CatBoost reduces overfitting needs,CatBoost requires less parameter tuning,Artificial Intelligence (AI) and Machine Learning (ML),Advanced
345,What is Bayesian optimization?,Bayesian optimization hyperparameter tuning,Bayesian optimization uses probabilistic models,Optimization efficiently searches parameter space,Bayesian optimization sample-efficient,Artificial Intelligence (AI) and Machine Learning (ML),Advanced
346,What is hyperparameter tuning?,Hyperparameter tuning optimizing model parameters,Tuning improves model performance,Methods include grid search random search,Hyperparameter tuning crucial ML workflow,Artificial Intelligence (AI) and Machine Learning (ML),Intermediate
347,What is learning curve?,Learning curve plotting performance training size,Learning curves diagnose bias variance,Curves help determine sufficient data,Learning curves guide model improvement,Artificial Intelligence (AI) and Machine Learning (ML),Intermediate
348,What is confusion matrix?,Confusion matrix visualization classification performance,Matrix shows true false predictions,Confusion matrix calculates various metrics,Matrix essential classification evaluation,Artificial Intelligence (AI) and Machine Learning (ML),Intermediate
349,What is AUC-ROC?,AUC-ROC Area Under ROC Curve metric,AUC measures classifier performance,AUC value between 0 1 perfect,AUC-ROC robust classification metric,Artificial Intelligence (AI) and Machine Learning (ML),Intermediate
350,What is precision-recall curve?,Precision-recall curve imbalanced datasets,PR curve better imbalanced classes,PR curve focuses positive class,PR curve alternative ROC imbalanced,Artificial Intelligence (AI) and Machine Learning (ML),Intermediate
351,What is AWS VPC peering?,VPC peering connecting two VPCs privately,Peering enables cross-VPC communication,VPC peering same cross-region,Peering provides network isolation,Cloud Computing (AWS/Azure/GCP),Intermediate
352,What is AWS Direct Connect?,Direct Connect dedicated network connection AWS,Direct Connect provides consistent latency,Dedicated connection bypasses internet,Direct Connect hybrid cloud networking,Cloud Computing (AWS/Azure/GCP),Advanced
353,What is AWS Route 53?,Route 53 scalable DNS web service,Route 53 domain registration DNS routing,Route 53 provides health checking,Route 53 essential AWS networking,Cloud Computing (AWS/Azure/GCP),Intermediate
354,What is AWS IAM policy?,IAM policy defining permissions resources,IAM policies JSON permission documents,Policies define allowed denied actions,IAM policies principle least privilege,Cloud Computing (AWS/Azure/GCP),Intermediate
355,What is AWS S3 Glacier?,S3 Glacier low-cost archival storage,Glacier designed long-term backup,Glacier provides various retrieval options,Glacier secure durable storage,Cloud Computing (AWS/Azure/GCP),Intermediate
356,What is Azure Virtual Network?,Azure VNet isolated cloud network,VNet enables Azure resource connectivity,VNet provides segmentation security,Azure networking foundation,Cloud Computing (AWS/Azure/GCP),Intermediate
357,What is Azure Load Balancer?,Azure Load Balancer distributing network traffic,Load Balancer provides high availability,Load Balancer works layer 4 TCP/UDP,Azure Load Balancer scalable,Cloud Computing (AWS/Azure/GCP),Intermediate
358,What is Azure Active Directory?,Azure AD Microsoft cloud identity service,Azure AD provides authentication authorization,Azure AD enables single sign-on,Azure AD essential Azure security,Cloud Computing (AWS/Azure/GCP),Intermediate
359,What is Google Cloud VPC?,Google VPC virtual private cloud,VPC provides global scalable networking,Google VPC enables resource isolation,VPC foundation GCP networking,Cloud Computing (AWS/Azure/GCP),Intermediate
360,What is Google Cloud IAM?,Google IAM managing resource access,IAM provides fine-grained permissions,Google IAM includes roles members,IAM ensures secure GCP access,Cloud Computing (AWS/Azure/GCP),Intermediate
361,What is security risk assessment?,Risk assessment identifying evaluating risks,Risk assessment quantifies risk levels,Assessment guides risk treatment,Risk assessment foundational security,Cybersecurity,Intermediate
362,What is vulnerability management?,Vulnerability management continuous vulnerability handling,Management includes discovery prioritization remediation,Vulnerability management reduces exposure,Proactive vulnerability management essential,Cybersecurity,Intermediate
363,What is security control testing?,Control testing verifying security effectiveness,Testing validates control implementation,Control testing includes automated manual,Testing ensures controls working properly,Cybersecurity,Intermediate
364,What is security architecture?,Security architecture designing secure systems,Architecture includes principles patterns,Security architecture guides implementation,Proper architecture enables security,Cybersecurity,Advanced
365,What is defense in depth?,Defense in depth multiple security layers,Defense depth provides redundancy,Layered security improves protection,Defense depth security principle,Cybersecurity,Intermediate
366,What is security training?,Security training educating staff security,Training reduces human error risks,Security training ongoing process,Effective training security culture,Cybersecurity,Beginner
367,What is incident response plan?,IR plan documenting incident procedures,Plan includes roles communication procedures,IR plan enables organized response,Incident response plan essential,Cybersecurity,Intermediate
368,What is business continuity plan?,BCP maintaining operations disruptions,BCP includes recovery strategies,Business continuity ensures availability,BCP complements disaster recovery,Cybersecurity,Intermediate
369,What is disaster recovery plan?,DRP restoring IT systems disasters,DRP includes recovery procedures,Disaster recovery minimizes downtime,DRP crucial data protection,Cybersecurity,Intermediate
370,What is security policy?,Security policy defining security requirements,Policy establishes rules guidelines,Security policy foundation program,Policy communicates expectations,Cybersecurity,Intermediate
371,What is data preprocessing pipeline?,Preprocessing pipeline automating data preparation,Pipeline handles cleaning transformation,Automated pipelines ensure consistency,Preprocessing pipelines efficient,Data Science and Data Analytics,Intermediate
372,What is feature engineering?,Feature engineering creating new features,Engineering improves model performance,Feature engineering domain knowledge,Engineering crucial ML success,Data Science and Data Analytics,Intermediate
373,What is feature scaling?,Feature scaling normalizing feature ranges,Scaling improves algorithm performance,Methods include min-max standardization,Feature scaling preprocessing step,Data Science and Data Analytics,Intermediate
374,What is dimensionality reduction?,Dimensionality reduction reducing feature count,Reduction improves efficiency performance,Methods include PCA t-SNE,Dimensionality reduction visualization,Data Science and Data Analytics,Intermediate
375,What is model evaluation?,Model evaluation assessing model performance,Evaluation uses metrics cross-validation,Proper evaluation prevents overfitting,Model evaluation ML critical step,Data Science and Data Analytics,Intermediate
376,What is model selection?,Model selection choosing best algorithm,Selection considers performance complexity,Model selection involves comparison,Selection crucial ML pipeline,Data Science and Data Analytics,Intermediate
377,What is hyperparameter optimization?,Hyperparameter optimization tuning parameters,Optimization improves model performance,Methods include grid Bayesian search,Hyperparameter optimization automated,Data Science and Data Analytics,Advanced
378,What is model interpretability?,Model interpretability understanding model decisions,Interpretability builds trust compliance,Methods include SHAP LIME,Interpretability crucial regulated industries,Data Science and Data Analytics,Intermediate
379,What is model deployment?,Model deployment putting models production,Deployment enables real-world use,Deployment strategies include A/B testing,Model deployment ML lifecycle,Data Science and Data Analytics,Intermediate
380,What is model monitoring?,Model monitoring tracking production performance,Monitoring detects drift degradation,Continuous monitoring ensures effectiveness,Model monitoring operational phase,Data Science and Data Analytics,Intermediate
381,What is infrastructure as code testing?,IaC testing validating infrastructure code,Testing ensures correctness security,IaC testing prevents misconfigurations,Testing crucial reliable infrastructure,DevOps and CI/CD,Intermediate
382,What is container security?,Container security protecting container environments,Security includes image scanning runtime,Container security multi-layered approach,Container security crucial production,DevOps and CI/CD,Intermediate
383,What is Kubernetes security?,Kubernetes security protecting clusters,Security includes RBAC network policies,Proper Kubernetes security essential,Kubernetes security complex important,DevOps and CI/CD,Advanced
384,What is DevOps maturity model?,DevOps maturity assessing DevOps progression,Model includes automation culture metrics,Maturity model guides improvement,DevOps maturity continuous journey,DevOps and CI/CD,Intermediate
385,What is site reliability engineering?,SRE implementing reliability engineering,SRE uses service level objectives,SRE balances features reliability,SRE Google-developed methodology,DevOps and CI/CD,Advanced
386,What is Python package management?,Package management managing Python dependencies,Tools include pip conda poetry,Package management ensures reproducibility,Proper management crucial projects,Python (Programming Language),Intermediate
387,What is Python virtual environment?,Virtual environment isolated Python environment,Environments prevent dependency conflicts,Virtual environments project-specific,Environments essential Python development,Python (Programming Language),Beginner
388,What is Python type checking?,Type checking verifying type annotations,Tools include mypy pyright,Type checking catches errors early,Type checking improves code quality,Python (Programming Language),Intermediate
389,What is Python profiling?,Profiling measuring program performance,Profiling identifies bottlenecks,Python profiling tools cProfile,Profiling guides optimization,Python (Programming Language),Advanced
390,What is Python debugging?,Debugging finding fixing code errors,Python debugger pdb commands,Debugging essential development,Effective debugging saves time,Python (Programming Language),Intermediate
391,What is JavaScript event delegation?,Event delegation handling events parent element,Delegation uses event bubbling,Delegation improves performance memory,Event delegation efficient event handling,JavaScript / TypeScript,Intermediate
392,What is JavaScript module pattern?,Module pattern creating encapsulated modules,Pattern uses IIFE closures,Module pattern provides privacy,Module pattern organization technique,JavaScript / TypeScript,Intermediate
393,What is JavaScript currying?,Currying transforming multi-argument functions,Currying creates function sequence,Currying enables partial application,Currying functional programming technique,JavaScript / TypeScript,Advanced
394,What is JavaScript memoization?,Memoization caching function results,Memoization improves performance,Memoization trade-off memory speed,JavaScript memoization optimization,JavaScript / TypeScript,Intermediate
395,What is JavaScript debouncing?,Debouncing limiting function call frequency,Debouncing groups multiple calls,Debouncing improves performance,Debouncing useful search inputs,JavaScript / TypeScript,Intermediate
396,What is graph algorithm?,Graph algorithm solving graph problems,Algorithms include traversal path finding,Graph algorithms network analysis,Graph algorithms fundamental CS,Data Structures and Algorithms (DSA),Intermediate
397,What is dynamic programming pattern?,DP pattern solving optimization problems,Pattern uses memoization tabulation,DP breaks problems subproblems,Dynamic programming powerful technique,Data Structures and Algorithms (DSA),Advanced
398,What is greedy algorithm pattern?,Greedy pattern making local optimal choices,Greedy hopes local global optimum,Greedy efficient not always optimal,Greedy pattern problem-solving,Data Structures and Algorithms (DSA),Intermediate
399,What is divide conquer pattern?,Divide conquer breaking problems subproblems,Pattern includes divide conquer combine,Divide conquer efficient algorithms,Divide conquer common pattern,Data Structures and Algorithms (DSA),Intermediate
400,What is backtracking pattern?,Backtracking incrementally building solutions,Backtracking abandons invalid paths,Backtracking exhaustive search,Backtracking constraint satisfaction,Data Structures and Algorithms (DSA),Advanced
401,What is database transaction management?,Transaction management ensuring ACID properties,Management includes commit rollback,Transaction management crucial consistency,Proper management prevents data corruption,Database Management (SQL/NoSQL),Intermediate
402,What is database backup strategy?,Backup strategy planning data protection,Strategy includes full incremental backups,Backup strategy ensures recoverability,Proper backups disaster recovery,Database Management (SQL/NoSQL),Intermediate
403,What is database recovery?,Recovery restoring database failures,Recovery uses backups transaction logs,Recovery procedures minimize data loss,Database recovery business continuity,Database Management (SQL/NoSQL),Advanced
404,What is database performance tuning?,Performance tuning optimizing database performance,Tuning includes query optimization indexing,Performance tuning ensures responsiveness,Continuous tuning maintains performance,Database Management (SQL/NoSQL),Advanced
405,What is database security?,Database security protecting database systems,Security includes authentication encryption,Database security prevents breaches,Security crucial sensitive data,Database Management (SQL/NoSQL),Intermediate
406,What is React state lifting?,State lifting moving state common ancestor,Lifting enables sibling communication,State lifting pattern React,State lifting component architecture,Full-Stack Development,Intermediate
407,What is React composition?,Composition building components combining,Composition enables reusability flexibility,React favors composition inheritance,Composition fundamental React,Full-Stack Development,Intermediate
408,What is React higher-order component?,HOC function taking component returning component,HOCs enable code reuse logic,HOC pattern React reuse,HOCs similar decorator pattern,Full-Stack Development,Advanced
409,What is React render props?,Render prop function prop rendering,Render props enable component reuse,Render props pattern React,Render props alternative HOCs,Full-Stack Development,Advanced
410,What is React custom hooks?,Custom hooks extracting component logic,Custom hooks enable logic reuse,Custom hooks React 16.8+,Custom hooks composable logic,Full-Stack Development,Intermediate
411,What is CSS architecture?,CSS architecture organizing CSS code,Architecture includes methodologies tools,Proper architecture maintainability,CSS architecture scales applications,Full-Stack Development,Intermediate
412,What is CSS methodology?,CSS methodology structured approach,Methodologies include BEM SMACSS,Methodologies improve consistency,CSS methodology team scaling,Full-Stack Development,Intermediate
413,What is CSS preprocessor?,CSS preprocessor extending CSS functionality,Preprocessors include Sass Less,Preprocessors enable variables nesting,CSS preprocessor productivity,Full-Stack Development,Intermediate
