Question Number,Question,Answer1,Answer2,Answer3,Answer4,Category,Difficulty
138,What is CSS Grid?,CSS Grid two-dimensional layout system handling rows columns simultaneously,Grid Layout enables complex responsive web designs rows columns,CSS Grid creates grid-based layouts with precise control positioning,Grid system allows designing web pages using grid lines areas,Full-Stack Development,Intermediate
139,What is JWT JSON Web Token?,JWT compact URL-safe means representing claims two parties,JWT used authentication authorization transmitting information securely,JWTs contain encoded JSON objects digitally signed verifying authenticity,JWT tokens enable stateless authentication between client server,Full-Stack Development,Intermediate
140,What is OAuth?,OAuth open standard authorization enabling secure delegated access,OAuth allows websites applications access resources without passwords,OAuth provides secure limited access user resources third-party apps,OAuth enables authentication authorization without sharing credentials,Full-Stack Development,Intermediate
141,What is difference SQL NoSQL databases?,SQL databases relational structured schema NoSQL non-relational flexible schema,SQL uses tables relationships NoSQL documents key-value graph column models,SQL databases ACID compliant NoSQL offers scalability flexibility unstructured,SQL provides strong consistency NoSQL offers high availability partition,Database Management (SQL/NoSQL),Beginner
142,What is database transaction isolation levels?,Isolation levels define visibility changes transactions concurrent operations,Levels include Read Uncommitted Read Committed Repeatable Read Serializable,Isolation levels control how transactions interact concurrent modifications,Transaction isolation prevents phenomena dirty reads non-repeatable reads,Database Management (SQL/NoSQL),Advanced
143,What is database connection pooling?,Connection pooling maintains cache database connections reusing them,Pooling reduces overhead establishing closing database connections frequently,Connection pools manage multiple database connections improving performance,Pooling allows applications share reuse database connections efficiently,Database Management (SQL/NoSQL),Intermediate
144,What is database view?,Database view virtual table based result set SQL statement,Views store queries virtual tables simplifying complex data access,Database views provide customized presentations underlying table data,Views enable security abstraction presenting limited data users,Database Management (SQL/NoSQL),Intermediate
145,What is database trigger?,Database trigger procedural code automatically executed specific events,Triggers run automatically when INSERT UPDATE DELETE operations occur,Database triggers enforce business rules data integrity automatically,Triggers respond database events maintaining consistency integrity,Database Management (SQL/NoSQL),Advanced
146,What is Python Flask framework?,Flask lightweight Python web framework building web applications,Flask microframework providing tools libraries web development,Flask simple extensible framework routing templating capabilities,Flask minimalistic approach web development Python,Full-Stack Development,Intermediate
147,What is Python Django framework?,Django high-level Python web framework encouraging rapid development,Django follows MVC pattern providing ORM authentication admin interface,Django batteries-included framework many built-in features,Django scalable secure framework building complex web applications,Full-Stack Development,Intermediate
148,What is React hooks?,React hooks functions letting use state lifecycle features function components,Hooks enable state management functional components without classes,React hooks include useState useEffect useContext custom hooks,Hooks simplify state side effects management React function components,Full-Stack Development,Intermediate
149,What is Redux state management?,Redux predictable state container JavaScript applications managing application state,Redux centralized store managing state across components applications,Redux uses actions reducers maintain predictable state updates,Redux enables state management complex applications predictable manner,Full-Stack Development,Advanced
150,What is Webpack module bundler?,Webpack static module bundler modern JavaScript applications,Webpack bundles JavaScript files browsers including transformations,Webpack processes modules dependencies generating optimized bundles,Webpack configuration-based bundler supporting various assets processing,Full-Stack Development,Advanced
151,What is gradient descent optimization?,Gradient descent optimization algorithm minimizing loss function iteratively moving steepest descent,Gradient descent finds local minimum function adjusting parameters learning rate,Gradient descent updates model parameters reducing error each iteration,Gradient descent fundamental optimization machine learning neural networks,Artificial Intelligence (AI) and Machine Learning (ML),Intermediate
152,What is batch size neural networks?,Batch size number training examples used one iteration gradient update,Batch size determines how many samples processed before updating model,Batch size affects training speed memory requirements model convergence,Small batches noisy updates large batches smooth but memory intensive,Artificial Intelligence (AI) and Machine Learning (ML),Intermediate
153,What is learning rate neural networks?,Learning rate controls how much adjust model parameters each update,Learning rate determines step size gradient descent optimization,High learning rate may overshoot low may converge slowly get stuck,Learning rate crucial hyperparameter affecting training convergence stability,Artificial Intelligence (AI) and Machine Learning (ML),Intermediate
154,What is activation function neural networks?,Activation function determines output neural network node given inputs,Activation functions introduce non-linearity enabling complex pattern learning,Common activations include ReLU Sigmoid Tanh enabling non-linear transformations,Activation functions decide whether neuron should activated passed forward,Artificial Intelligence (AI) and Machine Learning (ML),Intermediate
155,What is backpropagation?,Backpropagation algorithm calculating gradients neural network using chain rule,Backpropagation computes error derivatives with respect network weights,Backprop efficiently calculates gradients for optimization neural networks,Backpropagation enables neural networks learn adjusting weights backwards,Artificial Intelligence (AI) and Machine Learning (ML),Intermediate
156,What is vanishing exploding gradient problem?,Vanishing gradient gradients become too small stopping learning deep networks,Exploding gradient gradients grow exponentially causing unstable training,Vanishing gradient prevents weight updates deep layers exploding causes overflow,These problems affect training deep neural networks gradient flow issues,Artificial Intelligence (AI) and Machine Learning (ML),Advanced
157,What is word embedding?,Word embedding technique representing words dense vectors capturing meaning,Word embeddings map words numerical vectors preserving semantic relationships,Embeddings place similar words close vector space enabling meaning capture,Word2Vec GloVe popular word embedding methods natural language processing,Artificial Intelligence (AI) and Machine Learning (ML),Intermediate
158,What is recurrent neural network RNN?,RNN neural network handling sequential data using internal memory,RNNs process sequences maintaining state across time steps,RNNs suitable time series natural language processing sequential data,RNN architectures include LSTM GRU handling long-term dependencies,Artificial Intelligence (AI) and Machine Learning (ML),Intermediate
159,What is LSTM network?,LSTM Long Short-Term Memory RNN variant handling long-term dependencies,LSTM uses gates controlling information flow preventing vanishing gradient,LSTM architecture includes input forget output gates memory cells,LSTMs effective sequence modeling tasks requiring memory long sequences,Artificial Intelligence (AI) and Machine Learning (ML),Advanced
160,What is transformer model?,Transformer model using self-attention mechanisms processing sequential data,Transformers enable parallel processing handling long-range dependencies effectively,Transformer architecture revolutionized natural language processing tasks,Transformers use encoder-decoder structure with multi-head attention layers,Artificial Intelligence (AI) and Machine Learning (ML),Advanced
161,What is AWS CloudFormation?,AWS CloudFormation service modeling setting AWS resources using templates,CloudFormation allows infrastructure code defining cloud resources templates,CloudFormation provisions manages AWS infrastructure declarative templates,CloudFormation automates AWS resource deployment using JSON YAML templates,Cloud Computing (AWS/Azure/GCP),Intermediate
162,What is AWS Elastic Beanstalk?,AWS Elastic Beanstalk platform service deploying scaling web applications,Elastic Beanstalk handles deployment capacity provisioning load balancing,Beanstalk automatically handles details capacity provisioning monitoring,Elastic Beanstalk simplifies application deployment managing infrastructure,Cloud Computing (AWS/Azure/GCP),Intermediate
163,What is Azure Resource Manager?,Azure Resource Manager deployment management service Azure resources,ARM provides consistent management layer Azure services,Azure Resource Manager enables infrastructure as code Azure deployments,ARM allows grouping resources management governance capabilities,Cloud Computing (AWS/Azure/GCP),Intermediate
164,What is Google Cloud App Engine?,Google Cloud App Engine platform service building scalable web applications,App Engine fully managed platform deploying applications without infrastructure,App Engine automatically scales applications based traffic demand,Google App Engine supports multiple programming languages frameworks,Cloud Computing (AWS/Azure/GCP),Intermediate
165,What is cloud load balancing?,Cloud load balancing distributes traffic across multiple instances resources,Load balancing improves availability reliability applications distributing load,Cloud load balancers automatically route traffic healthy instances,Load balancing ensures optimal resource utilization fault tolerance,Cloud Computing (AWS/Azure/GCP),Intermediate
166,What is cloud storage tiering?,Cloud storage tiering offers different storage classes cost performance,Tiering includes hot cool archive storage with varying access costs,Storage tiers optimized frequently infrequently accessed data,Cloud storage classes balance cost performance based data access patterns,Cloud Computing (AWS/Azure/GCP),Intermediate
167,What is cloud disaster recovery?,Cloud disaster recovery strategies restoring IT infrastructure after disruptions,DR involves backup replication solutions ensuring business continuity,Cloud DR provides geographic redundancy data protection services,Disaster recovery cloud minimizes downtime data loss during outages,Cloud Computing (AWS/Azure/GCP),Intermediate
168,What is cloud monitoring?,Cloud monitoring tracking measuring performance health cloud resources,Monitoring involves collecting metrics logs analyzing system behavior,Cloud monitoring provides visibility application infrastructure performance,Monitoring tools alert anomalies help troubleshooting optimization,Cloud Computing (AWS/Azure/GCP),Intermediate
169,What is cloud security group?,Cloud security group virtual firewall controlling traffic instances,Security groups stateful filtering rules governing inbound outbound traffic,Security groups operate instance level providing network security,Security groups default deny all traffic explicitly allowed rules,Cloud Computing (AWS/Azure/GCP),Intermediate
170,What is cloud identity access management?,Cloud IAM manages access control cloud resources users groups,IAM enables defining permissions policies resource access,IAM provides centralized control over cloud services access,IAM ensures principle least privilege securing cloud environments,Cloud Computing (AWS/Azure/GCP),Intermediate
171,What is intrusion detection system IDS?,IDS monitors network system activities detecting malicious activities,Intrusion detection systems identify security policy violations attacks,IDS analyzes traffic patterns identifying suspicious behavior,Network IDS monitor traffic host IDS monitor individual systems,Cybersecurity,Intermediate
172,What is intrusion prevention system IPS?,IPS actively blocks prevents detected threats in real-time,Intrusion prevention systems detect block malicious activities automatically,IPS extends IDS capabilities by taking action against threats,IPS can drop packets reset connections block malicious traffic,Cybersecurity,Intermediate
173,What is security incident response?,Security incident response process addressing managing security breaches,Incident response involves detection analysis containment eradication recovery,IR plan outlines steps taken during security incidents,Incident response aims minimize damage recovery time costs,Cybersecurity,Intermediate
174,What is security vulnerability assessment?,Vulnerability assessment identifying classifying security weaknesses systems,Vulnerability scanning discovers security gaps misconfigurations,Vulnerability assessment prioritizes risks remediation actions,VA provides systematic review security posture organization,Cybersecurity,Intermediate
175,What is security penetration testing?,Penetration testing simulating attacks identifying exploitable vulnerabilities,Pen testing involves authorized attempts breach system security,Pentesters use tools techniques mimicking real attackers,Penetration testing validates security controls identifies weaknesses,Cybersecurity,Advanced
176,What is security compliance auditing?,Security compliance auditing verifying adherence security standards regulations,Compliance audits assess whether security controls meet requirements,Auditing involves reviewing policies procedures technical controls,Compliance audits ensure organizations meet legal regulatory obligations,Cybersecurity,Intermediate
177,What is security risk management?,Security risk management identifying assessing mitigating security risks,Risk management involves risk assessment treatment monitoring,Risk management framework manages organizational security risks,Risk management balances security measures business objectives,Cybersecurity,Intermediate
178,What is security awareness training?,Security awareness training educating employees security best practices,Awareness training reduces human error security incidents,Training covers phishing social engineering password security topics,Security awareness creates security-conscious organizational culture,Cybersecurity,Beginner
179,What is security patch management?,Patch management process deploying software updates security fixes,Patch management involves testing deploying patches systematically,Effective patching reduces vulnerability exposure security risks,Patch management ensures systems updated known vulnerabilities,Cybersecurity,Intermediate
180,What is security configuration management?,Configuration management maintaining consistent secure system configurations,Configuration management establishes enforces security baselines,Security configurations reduce attack surface hardening systems,Configuration management ensures systems compliant security policies,Cybersecurity,Intermediate
181,What is data cleaning process?,Data cleaning process identifying correcting inaccurate corrupt data,Data cleaning involves handling missing values outliers inconsistencies,Cleaning improves data quality ensuring reliable analysis results,Data cleaning includes validation transformation standardization,Data Science and Data Analytics,Intermediate
182,What is data validation?,Data validation ensuring data quality accuracy completeness,Validation checks data meets specific criteria requirements,Data validation prevents incorrect data entering systems,Validation rules verify data integrity business rules,Data Science and Data Analytics,Intermediate
183,What is data transformation?,Data transformation converting data format structure analysis,Transformation includes normalization aggregation encoding,Data transformation prepares data modeling analysis,Transformation enables data integration different sources,Data Science and Data Analytics,Intermediate
184,What is data visualization?,Data visualization graphical representation information data,Visualization uses charts graphs maps communicating insights,Data visualization helps understanding patterns trends,Effective visualization enables better decision-making communication,Data Science and Data Analytics,Beginner
185,What is statistical hypothesis testing?,Hypothesis testing making inferences about populations based samples,Hypothesis testing determines statistical significance results,Testing involves null hypothesis alternative hypothesis p-values,Hypothesis testing supports data-driven decision making,Data Science and Data Analytics,Intermediate
186,What is regression analysis?,Regression analysis modeling relationship dependent independent variables,Regression predicts continuous outcomes based input variables,Linear regression models linear relationships between variables,Regression analysis identifies factors influencing outcomes,Data Science and Data Analytics,Intermediate
187,What is classification algorithm?,Classification algorithm predicting categorical class labels,Classification assigns data points predefined categories,Common classifiers include logistic regression decision trees SVM,Classification used spam detection image recognition diagnostics,Data Science and Data Analytics,Intermediate
188,What is clustering algorithm?,Clustering algorithm grouping similar data points together,Clustering discovers inherent patterns structures data,Common clustering methods include K-means hierarchical DBSCAN,Clustering used customer segmentation pattern recognition,Data Science and Data Analytics,Intermediate
189,What is time series analysis?,Time series analysis analyzing data points sequential time order,Time series models patterns trends seasonal variations,Time series forecasting predicts future values based history,Time series used stock prices weather forecasting sales,Data Science and Data Analytics,Intermediate
190,What is anomaly detection?,Anomaly detection identifying rare items events suspicious patterns,Anomaly detection finds outliers deviating expected behavior,Anomaly detection used fraud detection network intrusion,Anomalies indicate significant deviations normal patterns,Data Science and Data Analytics,Intermediate
191,What is container orchestration?,Container orchestration automating deployment management scaling containers,Orchestration handles scheduling networking storage containers,Kubernetes Docker Swarm popular container orchestration platforms,Orchestration ensures containerized applications run reliably,DevOps and CI/CD,Intermediate
192,What is continuous monitoring?,Continuous monitoring constantly tracking system performance security,Monitoring provides real-time visibility application infrastructure,Continuous monitoring detects issues proactively enabling quick response,Monitoring includes metrics logs traces system observability,DevOps and CI/CD,Intermediate
193,What is infrastructure monitoring?,Infrastructure monitoring tracking health performance IT infrastructure,Infrastructure monitoring covers servers networks databases,Monitoring tools collect metrics CPU memory disk network usage,Infrastructure monitoring ensures reliability availability systems,DevOps and CI/CD,Intermediate
194,What is application performance monitoring?,APM monitoring measuring performance availability applications,APM tracks response times error rates throughput,Application monitoring identifies bottlenecks performance issues,APM tools provide code-level visibility application behavior,DevOps and CI/CD,Intermediate
195,What is log management?,Log management collecting storing analyzing log data,Log management centralizes logs multiple sources analysis,Effective log management enables troubleshooting security analysis,Log management systems parse index search log data,DevOps and CI/CD,Intermediate
196,What is alerting in DevOps?,Alerting notifying teams system issues anomalies,Alerting triggers notifications based predefined thresholds conditions,Effective alerting ensures timely response critical issues,Alerting reduces mean time detection resolution incidents,DevOps and CI/CD,Intermediate
197,What is blue-green deployment?,Blue-green deployment maintaining two identical environments switching traffic,Blue-green enables zero-downtime deployments quick rollbacks,Deployment involves routing traffic between blue production green new,Blue-green reduces deployment risk enabling instant rollback,DevOps and CI/CD,Advanced
198,What is canary deployment?,Canary deployment gradually rolling new version subset users,Canary releases minimize risk exposing changes small audience,Canary deployment monitors metrics before full rollout,Canary approach detects issues early limited impact,DevOps and CI/CD,Advanced
199,What is feature flag?,Feature flag toggle enabling disabling features without deployment,Feature flags allow controlled feature releases testing,Flags enable A/B testing gradual rollouts emergency kill switches,Feature flags separate deployment release processes,DevOps and CI/CD,Intermediate
200,What is chaos engineering?,Chaos engineering experimenting systems building reliability,Chaos engineering intentionally injects failures test resilience,Chaos experiments identify weaknesses before cause outages,Chaos engineering improves system reliability fault tolerance,DevOps and CI/CD,Advanced
201,What is Python exception handling?,Python exception handling manages errors using try except blocks,Exception handling prevents program crashes handling errors gracefully,Try block contains code might raise except handles specific exceptions,Exception handling includes finally cleanup regardless exceptions,Python (Programming Language),Intermediate
202,What are Python modules packages?,Python modules files containing code packages directories organizing modules,Modules enable code organization reuse across projects,Packages contain __init__py file grouping related modules,Modules packages facilitate code modularity maintainability,Python (Programming Language),Beginner
203,What is Python lambda function?,Lambda function anonymous function defined single expression,Lambda functions concise way creating small anonymous functions,Lambdas can take multiple arguments return one expression value,Lambda functions useful functional programming operations,Python (Programming Language),Intermediate
204,What is Python slicing?,Sicing extracts portions sequences using start stop step indices,Slicing works lists strings tuples arrays sequences,Python slicing creates new sequences from existing ones,Slicing syntax sequence[startstopstep] extracts subsequences,Python (Programming Language),Intermediate
205,What is Python context manager?,Context manager manages resources using with statement automatically,Context managers handle setup teardown operations resources,Context managers implement __enter__ __exit__ methods,With statement ensures proper resource cleanup exceptions,Python (Programming Language),Intermediate
206,What is JavaScript closure?,Closure function retaining access outer scope after outer function returns,Closures remember environment they were created in,Closures enable data encapsulation private variables,Closures commonly used callbacks event handlers,JavaScript / TypeScript,Intermediate
207,What is JavaScript event loop?,Event loop mechanism handling asynchronous operations single thread,Event loop manages call stack callback queue microtasks,JavaScript runtime uses event loop non-blocking operations,Event loop enables asynchronous programming despite single thread,JavaScript / TypeScript,Advanced
208,What is JavaScript hoisting?,Hoisting mechanism moving declarations top scope before execution,Variable function declarations hoisted top their containing scope,Let const hoisted but not initialized temporal dead zone,Hoisting explains why functions called before declaration,JavaScript / TypeScript,Intermediate
209,What is JavaScript prototype?,Prototype mechanism enabling inheritance JavaScript objects,Each JavaScript object has prototype inheriting properties methods,Prototype chain allows objects inherit other objects,Prototype-based inheritance fundamental JavaScript,JavaScript / TypeScript,Advanced
210,What is JavaScript this keyword?,This keyword refers execution context current code,This value determined how function called context,This binding varies regular functions arrow functions methods,Understanding this crucial object-oriented JavaScript,JavaScript / TypeScript,Intermediate
211,What is TypeScript interface?,TypeScript interface defining structure object type checking,Interfaces describe shape objects classes implement,Interfaces enable type checking compile-time errors,TypeScript interfaces contract implementing classes,JavaScript / TypeScript,Intermediate
212,What is TypeScript generic?,Generics creating reusable components working multiple types,Generics enable type parameterization functions classes interfaces,TypeScript generics maintain type information flexible code,Generics provide type safety without sacrificing flexibility,JavaScript / TypeScript,Advanced
